{
    "policy_version": "1.0.0",
    "product": {
        "name": "STRling",
        "version": "4.0.0",
        "version_authority": "governance/release-policy.json#/product/version",
        "repository_projection": {
            "version": "3.0.0",
            "status": "preparation",
            "activation_owner": "P20-T02",
            "activation_rule": "P20-T02 must change this projection to 4.0.0 and regenerate every coordinated manifest in one governed change; no current manifest value is product-version authority."
        },
        "semver_rules": {
            "breaking_semantic_or_api_change": "Increment MAJOR when a Supported semantic guarantee, source API, machine contract, or compatibility promise is removed or incompatibly changed.",
            "backward_compatible_feature": "Increment MINOR for an additive feature that preserves every Supported contract in the current major line.",
            "backward_compatible_fix": "Increment PATCH for a correction that restores documented Supported behavior without adding or removing a compatibility guarantee.",
            "documentation_only_correction": "No product version change is required when normative meaning, public metadata, install behavior, and generated artifacts are unchanged; record an erratum when the corrected text was public.",
            "target_profile_data_update": "A profile-only fact correction uses the profile's independent version; also change product SemVer when the shipped compiler behavior or a public product support promise changes.",
            "security_fix": "Use PATCH when compatible, MINOR for an additive mitigation, and MAJOR for an unavoidable incompatible Supported-contract change; an advisory does not waive certification or publication authorization.",
            "packaging_only_fix": "Use PATCH for a new immutable public package that corrects installation or packaging; never replace an already published coordinate."
        }
    },
    "version_kinds": [
        {
            "id": "product",
            "authority": "governance/release-policy.json#/product/version",
            "semantics": "Public STRling compiler, CLI, binding, and coordinated implementation release identity using Semantic Versioning.",
            "product_version_effect": "Direct; this is the only product-version authority."
        },
        {
            "id": "semantic-specification",
            "authority": "spec/VERSIONING.md and the immutable ratified specification set",
            "semantics": "Independent MAJOR.MINOR identity for ratified language meaning; 1.0-draft.1 is a draft label and not a ratified version.",
            "product_version_effect": "A compiler release declares exact implemented specification identities; equal numbers never imply conformance."
        },
        {
            "id": "package-format-schema-protocol",
            "authority": "The applicable versioned schema or protocol contract",
            "semantics": "Compatibility of one serialization, ABI, protocol, or package format, not product identity.",
            "product_version_effect": "Change product SemVer only when the shipped Supported public behavior or compatibility promise changes."
        },
        {
            "id": "target-engine",
            "authority": "The upstream engine implementation and exact runtime evidence",
            "semantics": "Version of PCRE2, ECMAScript host, Python re host, or another execution engine.",
            "product_version_effect": "Never inferred from product version and never represented by an unbounded latest alias."
        },
        {
            "id": "target-profile",
            "authority": "spec/targets/profiles and the target-profile contract",
            "semantics": "Independent revision of governed target facts, capability decisions, lowering constraints, and uncertainty.",
            "product_version_effect": "May change independently unless compiler output or a public support guarantee changes."
        },
        {
            "id": "certification-profile",
            "authority": "toolchain.json and generated profile-source definitions",
            "semantics": "Independent identity of required operations and evidence aggregation.",
            "product_version_effect": "No automatic product change; the release binds to the exact certification-profile identity used."
        }
    ],
    "version_surfaces": [
        {
            "id": "root-tooling-manifest",
            "surface": "Root development-tooling npm manifest",
            "path": "package.json",
            "current_version": null,
            "authority": "Non-publishable repository tooling metadata",
            "consumer_visible": false,
            "coordinates_with_product": false,
            "independently_versioned": true,
            "publication_destination": "Not published",
            "disposition": "The root manifest is private tooling and must not acquire a product version or public package coordinate.",
            "probe": {
                "kind": "absent",
                "pointer": "/version",
                "expected": "absent"
            }
        },
        {
            "id": "rust-public-crate",
            "surface": "Public same-source strling Rust crate",
            "path": "Cargo.toml",
            "current_version": "3.0.0",
            "authority": "Product repository projection",
            "consumer_visible": true,
            "coordinates_with_product": true,
            "independently_versioned": false,
            "publication_destination": "crates.io",
            "disposition": "Must equal the active product projection. It compiles core/src directly behind a curated facade; no second semantic-kernel package/version is permitted.",
            "probe": {
                "kind": "regex",
                "pattern": "(?ms)^\\[package\\].*?^version\\s*=\\s*\"([^\"]+)\"",
                "expected": "repository_projection"
            }
        },
        {
            "id": "python-package",
            "surface": "Python package",
            "path": "bindings/python/pyproject.toml",
            "current_version": "3.0.0",
            "authority": "Product repository projection",
            "consumer_visible": true,
            "coordinates_with_product": true,
            "independently_versioned": false,
            "publication_destination": "PyPI",
            "disposition": "Former synchronization source; now a generated projection like every other product package.",
            "probe": {
                "kind": "regex",
                "pattern": "(?m)^version\\s*=\\s*\"([^\"]+)\"",
                "expected": "repository_projection"
            }
        },
        {
            "id": "typescript-package",
            "surface": "TypeScript/JavaScript package",
            "path": "bindings/typescript/package.json",
            "current_version": "3.0.0",
            "authority": "Product repository projection",
            "consumer_visible": true,
            "coordinates_with_product": true,
            "independently_versioned": false,
            "publication_destination": "npm",
            "disposition": "Must equal the active product projection; Node/browser support remains a separate support claim.",
            "probe": {
                "kind": "json",
                "pointer": "/version",
                "expected": "repository_projection"
            }
        },
        {
            "id": "php-package",
            "surface": "PHP Composer package",
            "path": "bindings/php/composer.json",
            "current_version": "3.0.0",
            "authority": "Product repository projection",
            "consumer_visible": true,
            "coordinates_with_product": true,
            "independently_versioned": false,
            "publication_destination": "Git tag consumed by Packagist/Composer",
            "disposition": "Must equal the active product projection; protocol 1.0.0 and ABI 1 remain independent identities.",
            "probe": {
                "kind": "json",
                "pointer": "/version",
                "expected": "repository_projection"
            }
        },
        {
            "id": "php-runtime-constant",
            "surface": "PHP public version constant",
            "path": "bindings/php/src/STRling.php",
            "current_version": "3.0.0",
            "authority": "Generated product repository projection",
            "consumer_visible": true,
            "coordinates_with_product": true,
            "independently_versioned": false,
            "publication_destination": "Composer package payload",
            "disposition": "Must match the package coordinate; must not be confused with interop protocol or native ABI constants.",
            "probe": {
                "kind": "regex",
                "pattern": "public const VERSION\\s*=\\s*'([^']+)'",
                "expected": "repository_projection"
            }
        },
        {
            "id": "ruby-runtime-constant",
            "surface": "Ruby public version constant",
            "path": "bindings/ruby/lib/strling.rb",
            "current_version": "3.0.0",
            "authority": "Generated product repository projection",
            "consumer_visible": true,
            "coordinates_with_product": true,
            "independently_versioned": false,
            "publication_destination": "RubyGems package payload",
            "disposition": "The runtime constant must equal the product package coordinate.",
            "probe": {
                "kind": "regex",
                "pattern": "(?m)^\\s*VERSION\\s*=\\s*'([^']+)'",
                "expected": "repository_projection"
            }
        },
        {
            "id": "ruby-gemspec-sentinel",
            "surface": "RubyGems build-time version sentinel",
            "path": "bindings/ruby/strling.gemspec",
            "current_version": "0.0.0.dev",